index,page,ID,title,kind,url,metascore,critic_count,critic_count_positive,critic_count_mixed,critic_count_negative,userscore,user_count,user_count_positive,user_count_mixed,user_count_negative,developer,publisher,record_label,platform,release_date,rating,esrb,esrb_reason,runtime,genre,cast,show_type,summary
39,18,tv_little-britain-usa,Little Britain USA,tv show,http://www.metacritic.com/tv/little-britain-usa,61,17,9,4,4,6.6,34,8,4,6,NA,HBO,NA,NA,"Sep 28, 2008",NA,NA,NA,30,Comedy,NA,New Series,"Based on the humor of UK comedians Matt Lucas and David Walliams, this BBC sketch comedy transplant will make its home at HBO. Set to be directed by David Schwimmer, the show will be shot on..."
40,18,tv_runs-house,Run's House,tv show,http://www.metacritic.com/tv/runs-house,44,10,0,8,2,8.8,178,115,2,15,NA,MTV,NA,NA,"Oct 13, 2005",NA,NA,NA,30,"[u'Comedy', u'Reality']",NA,On Hiatus / TBD,"Run's House is about former Run-DMC member turned reverend, Rev Run.  Living in his mansion with his lovely wife Justine, his two daughters Vanessa and Angela, then there are his three sons JoJo,..."
41,19,tv_important-things-with-demetri-martin,Important Things with Demetri Martin,tv show,http://www.metacritic.com/tv/important-things-with-demetri-martin,71,8,6,2,0,8.2,72,24,0,2,NA,Comedy Central,NA,NA,"Feb 11, 2009",NA,NA,NA,30,"[u'Comedy', u'Variety Shows']",NA,On Hiatus / TBD,"Comedian Demetri Martin brings his comic variety to his very own sketch show. In each episode, Demetri uses jokes, his own hair, stand up comedy, animation and music to compile a sketch about a..."
42,19,tv_the-colbert-report,The Colbert Report,tv show,http://www.metacritic.com/tv/the-colbert-report,65,22,13,7,2,8.7,144,82,3,7,NA,Comedy Central,NA,NA,"Oct 17, 2005",NA,NA,NA,30,"[u'Comedy', u'Talk Shows']",NA,Returning Series,"Tune in to The Colbert Report, as Stephen Colbert, from The Daily Show gives his own take on the issues of the day, and more importantly, to tell you why everyone else's take is just plain wrong...."
43,19,tv_gavin-and-stacey,Gavin and Stacey,tv show,http://www.metacritic.com/tv/gavin-and-stacey,79,7,7,0,0,8.8,11,3,1,0,NA,BBC-3,NA,NA,"May  6, 2007",NA,NA,NA,30,"[u'Comedy', u'Drama']",NA,Returning Series,"Gavin is from Essex, Stacey is from Wales. Things have been going great with their telephone romance, but now they are about to meet. Will things turn sour when they meet face-to-face, or will..."
44,19,tv_unhitched,Unhitched,tv show,http://www.metacritic.com/tv/unhitched,44,18,5,4,9,5.0,17,3,0,3,NA,FOX,NA,NA,"Mar  2, 2008",NA,NA,NA,30,Comedy,NA,Ended,"Unhitched is a single camera comedy that follows the lives of 4 'divorcees': Kate, Tommy, Freddy and Jack 'Gator' Gately. They are all newcomers to the world of dating and have to wade through its..."
45,20,tv_monty-python-almost-the-truth-the-lawyers-cut,Monty Python: Almost the Truth (The Lawyer's Cut),tv show,http://www.metacritic.com/tv/monty-python-almost-the-truth-the-lawyers-cut,84,8,8,0,0,9.1,9,2,0,0,NA,Sundance,NA,NA,"Oct 18, 2009",NA,NA,NA,60,"[u'Comedy', u'News/Documentary']",NA,Mini-Series,"In commemoration of its 40th year of offbeat humor, Monty Python's Flying Circus is to the be subject of a documentary that will air October 4-10, 2009. Expect all the major players to be in..."
46,20,tv_worst-week,Worst Week,tv show,http://www.metacritic.com/tv/worst-week,62,22,12,8,2,6.1,41,7,1,3,NA,CBS,NA,NA,"Sep 22, 2008",NA,NA,NA,30,Comedy,NA,Ended,"Worst Week, from the mind of Matt Tarses (Scrubs), is an American take on the British series The Worst Week of My Life. This CBS single camera offering centers on a young couple dealing with the..."
47,20,tv_the-thick-of-it-uk,The Thick of It (UK),tv show,http://www.metacritic.com/tv/the-thick-of-it-uk,90,4,4,0,0,8.1,23,8,0,2,NA,BBC-3,NA,NA,"May 19, 2005",NA,NA,NA,30,Comedy,NA,Returning Series,"Part scripted and part improvised, The Thick of It is a satirical comedy that takes place inside the gritty world of politics."
48,20,tv_the-return-of-jezebel-james,The Return of Jezebel James,tv show,http://www.metacritic.com/tv/the-return-of-jezebel-james,29,22,0,5,17,5.2,13,4,0,4,NA,FOX,NA,NA,"Mar 14, 2008",NA,NA,NA,30,"[u'Comedy', u'Drama']",NA,Ended,"Amy Sherman-Palladino, creator of Gilmore Girls, brings us this multi-camera comedy about how two estranged sisters who are polar opposites try to raise a baby together. Boston Legal's Parker Posey..."
49,20,tv_do-not-disturb,Do Not Disturb,tv show,http://www.metacritic.com/tv/do-not-disturb,22,16,0,2,14,3.8,9,2,0,2,NA,FOX,NA,NA,"Sep 10, 2008",NA,NA,NA,30,Comedy,NA,Ended,"A glamorous New York hotel has a not-so-glamorous staff in this multi-camera comedy project from FOX.

FOX originally ordered 13 episodes for broadcast during 2008/2009 season, however the show..."
50,21,tv_swingtown,Swingtown,tv show,http://www.metacritic.com/tv/swingtown,49,26,6,16,4,8.4,110,71,2,7,NA,CBS,NA,NA,"Jun  5, 2008",NA,NA,NA,60,"[u'Comedy', u'Drama']",NA,Ended,"This new period drama takes viewers back to the 1970s for a look at suburban households testing the murky waters of sexual revolution, following swingers throughout open marriages, ""key parties""..."
51,21,tv_30-rock,30 Rock,tv show,http://www.metacritic.com/tv/30-rock,67,31,21,8,2,8.1,183,67,5,12,NA,NBC,NA,NA,"Oct 11, 2006",NA,NA,NA,30,Comedy,NA,Returning Series,"Dealing with life in a studio at NBC's 30 Rockefeller Plaza (the title is a shortening of that), the show centers around Liz Lemon, played by Saturday Night Live's Tina Fey, who's the head writer..."
52,22,tv_reaper,Reaper,tv show,http://www.metacritic.com/tv/reaper,81,27,26,1,0,8.9,97,57,1,4,"Tara Butters, Michele Fazekas",The CW,NA,NA,"Sep 25, 2007",NA,NA,NA,60,"[u'Comedy', u'Drama']",NA,Ended,"Throughout Sam's life, he always wondered why his mom and dad were so easy on him. Whether it was sports, school, career choices, or picking on his little brother Kyle, Sam always got away with..."
53,22,tv_the-sarah-silverman-program,The Sarah Silverman Program,tv show,http://www.metacritic.com/tv/the-sarah-silverman-program,65,22,13,4,5,4.9,169,48,7,57,"Dan Harmon, Rob Schrab",Comedy Central,NA,NA,"Feb  1, 2007",NA,NA,NA,30,Comedy,NA,Returning Series,The Sarah Silverman Program is a musical/comedy that journeys into a world where daily life is anything but routine.  Silverman plays a character named Sarah Silverman and is joined by her...
54,22,tv_warehouse-13,Warehouse 13,tv show,http://www.metacritic.com/tv/warehouse-13,63,17,9,8,0,7.3,60,18,5,1,NA,Syfy,NA,NA,"Jul  7, 2009",NA,NA,NA,60,"[u'Science-Fiction', u'Comedy', u'Drama']",NA,Returning Series,Secret Service agents Pete Lattimer and Myka Bering are appointed to a secret storage facility housing unusual artifacts in South Dakota after saving the life of the President. The agents are...
55,22,tv_flight-of-the-conchords,Flight of the Conchords,tv show,http://www.metacritic.com/tv/flight-of-the-conchords,68,15,8,6,1,9.3,183,119,5,3,"James Bobin, Bret McKenzie, Jemaine Clement",HBO,NA,NA,"Jun 17, 2007",NA,NA,NA,30,Comedy,NA,Ended,"New Zealand duo Bret McKenzie and Jemaine Clement, AKA the folk/comedy-band Flight of the Conchords, star in this fictionalized look at their lives.
Bret and Jemaine are trying to make it big in..."
56,22,tv_back-to-you,Back to You,tv show,http://www.metacritic.com/tv/back-to-you,58,27,12,11,4,5.5,41,15,4,15,"Christopher Lloyd, Steven Levitan",FOX,NA,NA,"Sep 19, 2007",NA,NA,NA,30,Comedy,NA,Ended,"Back to You is a traditional live-audience sitcom starring sitcom veterans Kelsey Grammer (Cheers, Frasier) and Patricia Heaton (Everybody Loves Raymond) as co-news anchors who reunite at a..."
57,23,tv_twenty-good-years,Twenty Good Years,tv show,http://www.metacritic.com/tv/twenty-good-years,29,26,0,9,17,5.9,38,15,2,13,NA,NBC,NA,NA,"Oct 11, 2006",NA,NA,NA,30,Comedy,NA,Ended,"Twenty Good Years revolves around John Mason and Jeffrey Pyne, two polar opposites who disagree on just about everything. The only thing upon which they do agree is that they only have about twenty..."
58,23,tv_the-game,The Game,tv show,http://www.metacritic.com/tv/the-game,22,14,0,1,13,8.6,96,70,0,5,NA,The CW,NA,NA,"Oct  1, 2006",NA,NA,NA,30,"[u'Comedy', u'Drama', u'Sports']",NA,Returning Series,"THE GAME stars Tia Mowry as Melanie Barnett, a young, intelligent medical student, who is also the girlfriend of an eager rookie football player, Derwin Davis (Pooch Hall). Melanie decides to pass..."
59,23,tv_united-states-of-tara,United States of Tara,tv show,http://www.metacritic.com/tv/united-states-of-tara,67,24,15,7,2,7.9,56,17,1,3,NA,Showtime,NA,NA,"Jan 18, 2009",NA,NA,NA,30,"[u'Comedy', u'Drama']",NA,Ended,"Another twisted comedy about the unexpected nature of American families, this single-camera Showtime offering examines a wife and mother of two teens who suffers from dissociative identity..."
60,24,tv_eli-stone,Eli Stone,tv show,http://www.metacritic.com/tv/eli-stone,62,24,13,7,4,8.5,72,35,3,5,NA,ABC,NA,NA,"Jan 31, 2008",NA,NA,NA,60,"[u'Comedy', u'Drama']",NA,Ended,"Greg Berlanti and Marc Guggenheim bring us the tale of a San Francisco lawyer who finds out he has prophetic powers and decides to use them for good.

Eli Stone is produced by ABC Television..."
61,24,tv_greek,Greek,tv show,http://www.metacritic.com/tv/greek,62,8,5,2,1,8.2,95,50,0,13,Sean Smith,ABC Family,NA,NA,"Jul  9, 2007",NA,NA,NA,60,"[u'Comedy', u'Drama']",NA,Ended,This show is about a super social sister and her anti-social brother who are both dealing with living the Greek life in college. The series focuses on a group of college students in and out of the...
62,24,tv_thank-god-youre-here,Thank God You're Here,tv show,http://www.metacritic.com/tv/thank-god-youre-here,39,12,1,5,6,4.9,27,7,4,10,NA,NBC,NA,NA,"Apr  9, 2007",NA,NA,NA,60,"[u'Comedy', u'Variety Shows']",NA,Ended,"Thank God You're Here is an improv competition in which various comedic performers act in scenes without a script. The performers' comedy skills, improvisational fortitude and acting talents are..."
63,25,tv_freddie,Freddie,tv show,http://www.metacritic.com/tv/freddie,33,24,1,10,13,6.5,44,21,1,8,NA,ABC,NA,NA,"Oct 12, 2005",NA,NA,NA,30,"[u'Comedy', u'Drama']",NA,Ended,"Freddie Prinze, Jr. makes his television series starring debut in this offbeat family comedy from the team behind ""The Drew Carey Show"" and ""George Lopez."" Freddie Moreno (Prinze) had finally..."
64,25,tv_welcome-to-the-captain,Welcome to the Captain,tv show,http://www.metacritic.com/tv/welcome-to-the-captain,50,20,4,10,6,4.6,25,7,1,11,NA,CBS,NA,NA,"Feb  4, 2008",NA,NA,NA,30,Comedy,NA,Ended,"This single-camera comedy follows the life of Josh, a writer, and how his life changes after he moves into an old Hollywood apartment building. ""The Captain"" is the building and it is home to a..."
65,26,tv_head-cases,Head Cases,tv show,http://www.metacritic.com/tv/head-cases,43,22,5,7,10,5.9,8,6,0,1,NA,FOX,NA,NA,"Sep 14, 2005",NA,NA,NA,60,"[u'Comedy', u'Drama']",NA,Ended,"From writer-producers Bill Chais (""The Practice"") and Jeff Rake (""Boston Legal"")
""Head Cases"" centers on a successful lawyer who has a nervous breakdown and teams up with a mentally disturbed..."
66,26,tv_cupid,Cupid,tv show,http://www.metacritic.com/tv/cupid,52,24,8,12,4,8.0,12,8,0,2,NA,ABC,NA,NA,"Mar 31, 2009",NA,NA,NA,60,"[u'Comedy', u'Drama']",NA,Ended,"ABC Studios and Sony Television team up with Rob Thomas to bring back his 1998 series about a man who believes he is Cupid, who has been sent to earth by Zeus to help 100 couples get together as..."
67,27,tv_summer-heights-high,Summer Heights High,tv show,http://www.metacritic.com/tv/summer-heights-high,67,13,9,3,1,9.2,46,20,0,3,NA,ABC1,NA,NA,"Sep  5, 2007",NA,NA,NA,30,"[u'Comedy', u'News/Documentary']",NA,Ended,"Summer Heights High is the outrageously funny high school comedy created and written by Chris Lilley, creator of We Can Be Heroes. The mockumentary series documents the ups and downs of three..."
68,27,tv_ugly-betty,Ugly Betty,tv show,http://www.metacritic.com/tv/ugly-betty,75,29,25,3,1,8.3,150,80,3,13,NA,ABC,NA,NA,"Sep 28, 2006",NA,NA,NA,60,"[u'Comedy', u'Drama']",NA,Ended,"Betty Suarez has always had one goal in life: to make it into the publishing business. Despite being smart, hard-working, and productive, her dream has always been shadowed by the fact that she..."
69,27,tv_cavemen,Cavemen,tv show,http://www.metacritic.com/tv/cavemen,19,13,0,1,12,5.1,127,44,0,32,NA,ABC,NA,NA,"Oct  2, 2007",NA,NA,NA,30,Comedy,NA,Ended,"Cavemen revolves around Joel, his younger brother Andy and best friend Nick. Joel is engaged to Kate. Even though he has some problems with her conservative parents accepting him, he is happy with..."
70,27,tv_crumbs,Crumbs,tv show,http://www.metacritic.com/tv/crumbs,44,25,6,10,9,6.8,16,7,1,3,NA,ABC,NA,NA,"Jan 12, 2006",NA,NA,NA,30,Comedy,NA,Ended,"Family is enough to drive anyone a little crazy. Children keep secrets from their parents so they won't upset them, dads leave for other women and moms try to run over dads with the car. Actually,..."
71,28,tv_american-body-shop,American Body Shop,tv show,http://www.metacritic.com/tv/american-body-shop,29,5,1,0,4,6.0,9,4,0,2,NA,Comedy Central,NA,NA,"Jul  8, 2007",NA,NA,NA,30,Comedy,NA,Ended,American Body Shop is centered around the twice-divorced shop owner Sam and his troubled crew. Among his staff Sam has a set of mechanics and auto workers that develop complex solutions to simple...
72,28,tv_the-showbiz-show-with-david-spade,The Showbiz Show with David Spade,tv show,http://www.metacritic.com/tv/the-showbiz-show-with-david-spade,41,6,1,2,3,6.6,7,3,0,1,NA,Comedy Central,NA,NA,"Sep 15, 2005",NA,NA,NA,30,"[u'Comedy', u'Talk Shows', u'Reality']",NA,Ended,"The Showbiz Show with David Spade , hosted by television and movie funnyman David Spade, cuts past the glitz of Tinseltown and gets to the heart of the industry.  David Spades irreverent brand of..."
73,28,tv_secret-diary-of-a-call-girl,Secret Diary of a Call Girl,tv show,http://www.metacritic.com/tv/secret-diary-of-a-call-girl,53,22,9,8,5,6.4,16,5,1,4,NA,Showtime,NA,NA,"Jun 16, 2008",NA,NA,NA,30,"[u'Comedy', u'Drama']",NA,Ended,"Hannah is more than she appears to be in Secret Diary of a Call Girl.  Hannah is also Belle, one of the top high class call girls in the city of London.  Hannah and Belle have the same common goal;..."
74,29,tv_z-rock,Z Rock,tv show,http://www.metacritic.com/tv/z-rock,57,7,3,3,1,8.1,15,11,0,2,NA,IFC,NA,NA,"Aug 24, 2008",NA,NA,NA,30,Comedy,NA,New Series,"In this IFC comedy a three musicians are trying to land a record deal as the band Z02 while gigging at clubs. When this proves to be more difficult than they previously thought, the guys reinvent..."
75,29,tv_dog-bites-man,Dog Bites Man,tv show,http://www.metacritic.com/tv/dog-bites-man,54,11,4,5,2,8.2,40,26,0,6,NA,Comedy Central,NA,NA,"Jun  7, 2006",NA,NA,NA,30,Comedy,NA,Ended,Dog Bites Man is a wacky new part improvisational comedy that follows the antics of a fictional news team as they interact with real people in a man-on-the-street documentary style.
76,30,tv_dead-set,Dead Set,tv show,http://www.metacritic.com/tv/dead-set,77,6,5,1,0,8.6,14,2,0,0,NA,IFC,NA,NA,"Oct 25, 2010",NA,NA,NA,35,"[u'Comedy', u'Drama']",NA,Ended,"The dead are walking the streets and attacking the living across the UK. However, the contestants in this year's Big Brother house remain completely unaware.

During their time in the house, the..."
77,32,tv_halfway-home,Halfway Home,tv show,http://www.metacritic.com/tv/halfway-home,44,6,0,4,2,6.8,32,10,1,10,NA,Comedy Central,NA,NA,"Mar 14, 2007",NA,NA,NA,30,Comedy,NA,Ended,Recently paroled criminals must find a way to live together in the 'Halfway Home.' Crenshaw House is where the LA Bureau of Prisons houses some of its most notorious (though not always tough)...
78,32,tv_miss-guided,Miss Guided,tv show,http://www.metacritic.com/tv/miss-guided,63,18,7,11,0,8.3,21,6,1,0,NA,ABC,NA,NA,"Mar 18, 2008",NA,NA,NA,30,Comedy,NA,Ended,"This comedy series follows Becky Freeley, a woman working as a guidance counselor at the Glen Ellen High School which she once attended. She tries to help guide the students so that they will cope..."
79,32,tv_testees,Testees,tv show,http://www.metacritic.com/tv/testees,37,12,2,3,7,7.6,45,15,0,1,NA,FX,NA,NA,"Oct  9, 2008",NA,NA,NA,30,Comedy,NA,Ended,Testees is a comedy about two friends in their early thirties who act as medical guinea pigs.
80,32,tv_the-winner,The Winner,tv show,http://www.metacritic.com/tv/the-winner,44,24,8,5,11,3.8,60,15,4,26,Ricky Blitt,FOX,NA,NA,"Mar  4, 2007",NA,NA,NA,30,Comedy,NA,Ended,"A 43 year old narrator, who is incredibly rich and successful. Looks all the way back to 1994. When he lost his innocence and started to become a man - at the age of 32. In 1994 Glen Abbott (Rob..."
81,33,tv_four-kings,Four Kings,tv show,http://www.metacritic.com/tv/four-kings,40,18,1,9,8,6.8,30,17,2,6,NA,NBC,NA,NA,"Jan  5, 2006",NA,NA,NA,30,Comedy,NA,Ended,"The Emmy-winning creators of NBC's ""Will & Grace"" David Kohan and Max Mutchnick are creating ""Four Kings,"" their new comedy pilot for NBC. The executive producers of the Warner Bros. TV project..."
82,33,tv_the-12-hour-news-hour,The 1/2 Hour News Hour,tv show,http://www.metacritic.com/tv/the-12-hour-news-hour,12,11,0,1,10,2.8,372,77,4,202,NA,FOX News,NA,NA,"Feb 18, 2007",NA,NA,NA,30,"[u'Comedy', u'News/Documentary']",NA,New Series,"The 1/2 Hour News Hour, originally named This Just In, is a parody with a comedic view of the news and political world take on politics and news from a conservative view. The format is almost..."
83,34,tv_talkshow-with-spike-feresten,TALKSHOW with Spike Feresten,tv show,http://www.metacritic.com/tv/talkshow-with-spike-feresten,42,12,3,3,6,8.7,37,21,0,4,NA,FOX,NA,NA,"Sep 16, 2006",NA,NA,NA,30,"[u'Comedy', u'Talk Shows', u'Reality']",NA,Ended,"Emmy-nominated comic Spike Feresten has just splashed down into the seething, shark-infested ocean that is late-night talk TV. TALKSHOW with Spike Feresten is 30 hot minutes of comedy-infused talk,..."
84,34,tv_hot-properties,Hot Properties,tv show,http://www.metacritic.com/tv/hot-properties,31,22,4,4,14,8.1,33,20,0,6,NA,ABC,NA,NA,"Oct  7, 2005",NA,NA,NA,30,"[u'Comedy', u'Drama']",NA,Ended,"Hot Properties centers around four women who work for Hot Properties, a high-end Manhattan real estate firm.  Ava Summerlin, the oldest of the women, runs the firm.  She's married to a much-younger..."
85,34,tv_skins,Skins,tv show,http://www.metacritic.com/tv/skins,66,7,4,3,0,8.7,78,30,0,4,"Jamie Brittain, Bryan Elsley",E4,NA,NA,"Jan 25, 2007",NA,NA,NA,60,"[u'Comedy', u'Drama']",NA,On Hiatus / TBD,"Skins is a British teen drama aimed at young adults which is at the forefront of Channel 4's quest to bring more British programming to Britain.
Fast-paced and full of angst-ridden fun, this..."
86,35,tv_labor-pains,Labor Pains,tv show,http://www.metacritic.com/tv/labor-pains,55,7,1,6,0,5.9,7,2,1,1,NA,ABC Family,NA,NA,"Jul 19, 2009",NA,NA,NA,90,"[u'Comedy', u'Movie/Mini-Series']",NA,TV Movie,Lindsay Lohan stars in this ABC Family original movie about a publishing company employee who pretends to be pregnant so that she can't be fired.
87,35,tv_hustle,Hustle,tv show,http://www.metacritic.com/tv/hustle,71,13,11,2,0,9.3,38,24,0,0,NA,BBC-1,NA,NA,"Feb 24, 2004",NA,NA,NA,60,"[u'Comedy', u'Drama']",NA,Ended,"From the makers of Spooks and acclaimed writer Tony Jordan comes this slick and stylish drama. An action-packed blend of humour and intrigue, following the fortunes of a gang of expert cons on the..."
88,35,tv_men-of-a-certain-age,Men of a Certain Age,tv show,http://www.metacritic.com/tv/men-of-a-certain-age,79,24,22,2,0,8.8,119,45,2,6,NA,TNT,NA,NA,"Dec  7, 2009",NA,NA,NA,60,"[u'Comedy', u'Drama']",NA,Ended,"There are highs and lows to every age, but three best friends know what it's like to be Men of a Certain Age. Ray Romano stars in an honest, emotional and funny drama about what it is like to be a..."
89,35,tv_in-case-of-emergency,In Case of Emergency,tv show,http://www.metacritic.com/tv/in-case-of-emergency,27,23,0,5,18,6.9,18,11,1,4,"Jon Favreau, Howard J. Morris",ABC,NA,NA,"Jan  3, 2007",NA,NA,NA,30,Comedy,NA,Ended,"Harry, Jason, Sherman and Kelly all went to the same high school. Several years on since graduation, their lives haven't exactly turned out the way they planned. A series of emergencies will..."
90,36,tv_big-shots,Big Shots,tv show,http://www.metacritic.com/tv/big-shots,33,22,2,7,13,8.2,90,45,0,7,NA,ABC,NA,NA,"Sep 27, 2007",NA,NA,NA,60,"[u'Comedy', u'Drama']",NA,Ended,"Big Shots is a drama from Warner Brothers Television and ABC about four friends who are up and coming executives.James is played by Michael Vartan and is the ""moral center"" of the group. He's..."
91,36,tv_city-of-men,City of Men,tv show,http://www.metacritic.com/tv/city-of-men,87,7,7,0,0,9.2,14,12,0,0,NA,Sundance,NA,NA,"Apr  4, 2006",NA,NA,NA,30,"[u'Comedy', u'Drama']",NA,Ended,"From the creators of the Academy Award-nominated City of God, comes the spin-off series City of Men.  The series follows the lives of Acerola (Douglas Silva) and Laranjinha (Darlan Cunha) as they..."
92,36,tv_teachers,Teachers,tv show,http://www.metacritic.com/tv/teachers,34,16,0,6,10,6.5,63,31,2,15,NA,NBC,NA,NA,"Mar 28, 2006",NA,NA,NA,30,Comedy,NA,Ended,"Filmore is a New Jersey school that has its share of problems, including apathetic teachers, antiquated rules and a majority of students who are more interested in text-messaging than in textbooks."
93,36,tv_womens-murder-club,Women's Murder Club,tv show,http://www.metacritic.com/tv/womens-murder-club,51,23,10,7,6,7.8,17,8,1,1,NA,ABC,NA,NA,"Oct 12, 2007",NA,NA,NA,60,"[u'Comedy', u'Drama']",NA,Ended,"Based on the best-selling series of books by James Patterson, Women's Murder Club tells the story of four friends from different walks of life who come together to form a unique murder..."
94,38,tv_chocolate-news,Chocolate News,tv show,http://www.metacritic.com/tv/chocolate-news,66,13,9,4,0,3.1,42,5,1,20,NA,Comedy Central,NA,NA,"Oct 15, 2008",NA,NA,NA,30,Comedy,NA,Ended,David Alan Grier hosts this urban-leaning parody of magazine shows. 'News' correspondents are the sketch comedians.
95,38,tv_notes-from-the-underbelly,Notes from the Underbelly,tv show,http://www.metacritic.com/tv/notes-from-the-underbelly,38,24,4,8,12,7.0,37,20,0,8,Stacy Traub,ABC,NA,NA,"Apr 12, 2007",NA,NA,NA,30,Comedy,NA,Ended,"Meet Andrew and Lauren. They just found out that they are having a baby. They are about to deal with a lot of changes, first being lying to everyone about being pregnant for the first three months..."
96,38,tv_rules-of-engagement,Rules of Engagement,tv show,http://www.metacritic.com/tv/rules-of-engagement,28,27,0,8,19,7.7,96,49,3,7,Tom Hertz,CBS,NA,NA,"Feb  5, 2007",NA,NA,NA,30,Comedy,NA,Returning Series,"This new comedy follows the unique friendship between a married couple, a pair of newly engaged lovebirds, and a contented bachelor as they navigate the jungles of dating."
97,38,tv_inconceivable,Inconceivable,tv show,http://www.metacritic.com/tv/inconceivable,32,20,1,9,10,9.1,45,34,0,1,NA,NBC,NA,NA,"Sep 23, 2005",NA,NA,NA,60,"[u'Comedy', u'Drama']",NA,Ended,"""Inconceivable"" is an ensemble drama in which the doctors of the Family Options Fertility Clinic help desperate couples give birth.  The Clinic co-founders are attorney Rachel Lu and Dr. Malcolm..."
98,40,tv_eastbound-down,Eastbound & Down,tv show,http://www.metacritic.com/tv/eastbound-down,62,16,8,5,3,9.0,168,63,1,4,NA,HBO,NA,NA,"Feb 15, 2009",NA,NA,NA,30,"[u'Comedy', u'Sports']",NA,Returning Series,"Created by Will Ferrell and Adam McKay, this half-hour comedy follows a former professional baseball player who returns to his hometown in the South to take a job as a substitute gym teacher."
99,40,tv_related,Related,tv show,http://www.metacritic.com/tv/related,47,NA,NA,NA,NA,NA,NA,NA,NA,NA,NA,NA,NA,NA,"Oct  5, 2005",NA,NA,NA,NA,"[u'Comedy', u'Drama']",NA,NA,"The WB series Related, comes from the creative forces behind Friends and Sex and the City. The series tells the story of the lives of the four Sorelli sisters and their complicated lives as a..."
100,40,tv_accidentally-on-purpose,Accidentally on Purpose,tv show,http://www.metacritic.com/tv/accidentally-on-purpose,49,18,3,11,4,6.3,89,26,1,21,NA,CBS,NA,NA,"Sep 21, 2009",NA,NA,NA,30,Comedy,NA,Ended,A San Francisco newspaper film critic becomes pregnant after a hookup with a much younger man and together they raise a non-traditional family. Golden Globe Award winner Jenna Elfman (Dharma &...
101,41,tv_aliens-in-america,Aliens in America,tv show,http://www.metacritic.com/tv/aliens-in-america,77,26,24,2,0,8.0,26,4,1,1,NA,The CW,NA,NA,"Oct  1, 2007",NA,NA,NA,30,Comedy,NA,Ended,"A Wisconsin mom arranges to host a foreign exchange student, believing the visitor will help her shy son become more popular. When the student turns out to be a Muslim teenager from Pakistan, her..."
102,41,tv_the-real-wedding-crashers,The Real Wedding Crashers,tv show,http://www.metacritic.com/tv/the-real-wedding-crashers,19,10,0,1,9,2.9,15,2,2,7,NA,NBC,NA,NA,"Apr 23, 2007",NA,NA,NA,60,"[u'Comedy', u'Reality']",NA,Ended,Every bride and groom wants their big day to go off without a hitch.  Engaged couples spend countless hours and tens of thousands of dollars making sure every detail is perfect.  In this new...
103,41,tv_the-bill-engvall-show,The Bill Engvall Show,tv show,http://www.metacritic.com/tv/the-bill-engvall-show,35,7,0,3,4,3.1,33,5,0,19,NA,TBS,NA,NA,"Jul 17, 2007",NA,NA,NA,30,Comedy,NA,Ended,"This is the story of  Bill Pearson, a family counselor struggling to understand his own family. His wife, Susan Pearson is a stay-at-home mom determined to keep her family in line. They have 3..."
