index,page,ID,title,kind,url,metascore,critic_count,critic_count_positive,critic_count_mixed,critic_count_negative,userscore,user_count,user_count_positive,user_count_mixed,user_count_negative,developer,publisher,record_label,platform,release_date,rating,esrb,esrb_reason,runtime,genre,cast,show_type,summary
17,9,tv_take-the-money-and-run,Take The Money and Run,tv show,http://www.metacritic.com/tv/take-the-money-and-run,56,5,1,4,0,6.1,9,4,1,0,NA,ABC,NA,NA,"Aug  2, 2011",NA,NA,NA,60,"[u'Game Shows', u'Reality']",NA,Ended,"Bertram Van Munster and Jerry Bruckheimer, executive producers for The Amazing Race are creating a new action/adventure based reality shows. Casting calls are asking for contestants who ""have an..."
18,9,tv_love-in-the-wild,Love in the Wild,tv show,http://www.metacritic.com/tv/love-in-the-wild,48,8,1,5,2,7.5,13,5,1,0,NA,NBC,NA,NA,"Jun 29, 2011",NA,NA,NA,60,"[u'Game Shows', u'Reality']",NA,Returning Series,Prospective couples are placed in exotic locations and put to the test with multiple challenges in order to see if a romance can bloom.
19,9,tv_million-dollar-money-drop,Million Dollar Money Drop,tv show,http://www.metacritic.com/tv/million-dollar-money-drop,61,4,2,2,0,6.5,6,0,1,0,NA,FOX,NA,NA,"Dec 20, 2010",NA,NA,NA,60,"[u'Game Shows', u'Reality']",NA,Ended,Kevin Pollak hosts this new game show where contestants are given $1 million at the start of the game and they must work to hold onto it as the game goes on. All they have to do is answer 7...
20,9,tv_masterchef,MasterChef,tv show,http://www.metacritic.com/tv/masterchef,60,7,4,2,1,5.5,17,1,1,1,NA,FOX,NA,NA,"Jul 29, 2010",NA,NA,NA,60,"[u'Game Shows', u'Reality']",NA,Returning Series,FOX serves up a new food competition series with Gordon Ramsay at the helm. Think American Idol in the kitchen.
21,10,tv_the-marriage-ref,The Marriage Ref,tv show,http://www.metacritic.com/tv/the-marriage-ref,41,11,2,4,5,3.8,77,1,0,0,NA,NBC,NA,NA,"Feb 28, 2010",NA,NA,NA,60,"[u'Talk Shows', u'Game Shows', u'Reality']",NA,Returning Series,"From executive producer Jerry Seinfeld comes this new reality series that looks into the unexpected and absurd situations that arise in the marriages of celebrities, sports stars and just plain..."
22,10,tv_shark-tank,Shark Tank,tv show,http://www.metacritic.com/tv/shark-tank,55,11,4,5,2,7.3,37,17,0,8,NA,ABC,NA,NA,"Aug  9, 2009",NA,NA,NA,60,"[u'Game Shows', u'Reality']",NA,Returning Series,"Sony Pictures TV and executive producer Mark Burnett bring another business-themed reality show in which contestants pitch business ideas to major investors, aka ""sharks."" The show is based on the..."
23,10,tv_there-goes-the-neighborhood,There Goes the Neighborhood,tv show,http://www.metacritic.com/tv/there-goes-the-neighborhood,32,4,0,1,3,2.8,10,1,0,4,NA,CBS,NA,NA,"Aug  9, 2009",NA,NA,NA,60,"[u'Game Shows', u'Reality']",NA,On Hiatus / TBD,"In this reality competition series from CBS, eight families in a suburban cul-de-sac are pitted against each other as they vie to win upgrades to their lives and homes. Each week one family will be..."
0,0,tv_mrs-harris,Mrs. Harris,tv show,http://www.metacritic.com/tv/mrs-harris,70,21,15,5,1,9.0,10,9,0,1,NA,HBO,NA,NA,"Feb 25, 2006",NA,NA,NA,90,Movie/Mini-Series,NA,TV Movie,"This HBO film tells the story of Jean Harris, the ladylike headmistress of a New York prep school who shot and killed her lover of 14 years. Did ""Scarsdale Diet Doctor"" Herman Tarnower drive her to..."
1,2,tv_the-path-to-911,The Path to 9/11,tv show,http://www.metacritic.com/tv/the-path-to-911,52,18,9,3,6,5.3,84,30,3,23,NA,ABC,NA,NA,"Sep 10, 2006",NA,NA,NA,08:00 PM,"[u'Movie/Mini-Series', u'News/Documentary']",NA,Ended,"Where were you on 9/11? Relive the events of that fateful day and the years leading up to it with this ABC miniseries that takes you to the streets of New York, drops you in the center of a riot in..."
2,3,tv_once-upon-a-mattress,Once Upon a Mattress,tv show,http://www.metacritic.com/tv/once-upon-a-mattress,55,15,5,6,4,4.7,19,6,1,9,NA,ABC,NA,NA,"Dec 18, 2005",NA,NA,NA,120,Movie/Mini-Series,NA,Ended,"ABC brings a magical retelling of the timeless fairytale The Princess and the Pea to the small screen.  The star studded cast includes such greats as Carol Burnett and Tracey Ullman, along with..."
3,3,tv_addiction,Addiction,tv show,http://www.metacritic.com/tv/addiction,70,12,7,5,0,NA,0,0,0,1,NA,HBO,NA,NA,"Mar 15, 2007",NA,NA,NA,60,"[u'Movie/Mini-Series', u'News/Documentary']",NA,Mini-Series,"The Addiction Project is produced by HBO in partnership with the Robert Wood Johnson Foundation, the National Institute on Drug Abuse (NIDA) and the National Institute on Alcohol Abuse and..."
4,3,tv_martha-behind-bars,Martha Behind Bars,tv show,http://www.metacritic.com/tv/martha-behind-bars,42,8,0,6,2,NA,0,0,0,0,NA,CBS,NA,NA,"Sep 25, 2005",NA,NA,NA,120,Movie/Mini-Series,NA,TV Movie,Golden Globe Award winner Cybill Shepherd reprises her role as domestic diva Martha Stewart in Martha Behind Bars.  The movie chronicles the events leading up to her indictment for obstruction of...
5,3,tv_the-ten-commandments,The Ten Commandments,tv show,http://www.metacritic.com/tv/the-ten-commandments,39,18,4,6,8,2.7,28,6,0,17,NA,ABC,NA,NA,"Apr 10, 2006",NA,NA,NA,240,Movie/Mini-Series,NA,Mini-Series,"ABC brings the story of Moses to the small screen with its two-night miniseries, The Ten Commandments.  This visual spectacle tells the epic tale of Moses, who was inspired by God to lead the..."
6,5,tv_kings-of-south-beach,Kings of South Beach,tv show,http://www.metacritic.com/tv/kings-of-south-beach,36,7,1,1,5,6.3,4,2,0,1,NA,A&E,NA,NA,"Mar 12, 2007",NA,NA,NA,120,Movie/Mini-Series,NA,Ended,"""Kings of South Beach"", an A&E Original Movie, based on a true story, follows the rise of South Beach's most famous club promoter, Chris Troiano (Jason Gedrick).  His clubs were all the rage with..."
7,6,tv_stephen-kings-desperation,Stephen King's Desperation,tv show,http://www.metacritic.com/tv/stephen-kings-desperation,46,12,3,5,4,7.5,31,16,2,3,NA,ABC,NA,NA,"May 23, 2006",NA,NA,NA,180,"[u'Science-Fiction', u'Movie/Mini-Series']",NA,Ended,"While on their way to Lake Tahoe for a vacation, the Carver family is arrested on a lonely stretch of highway after the tires blow out on their camper.  The local sheriff throws them in jail in the..."
8,7,tv_have-no-fear-the-life-of-pope-john-paul-ii,Have No Fear: The Life of Pope John Paul II,tv show,http://www.metacritic.com/tv/have-no-fear-the-life-of-pope-john-paul-ii,36,20,2,6,12,6.2,13,5,1,3,NA,ABC,NA,NA,"Dec  1, 2005",NA,NA,NA,120,"[u'Movie/Mini-Series', u'News/Documentary']",NA,New Series,"This film portrays the life of Pope John Paul II over sixty years.

Born in 1920 in Wadowice, Poland, Karol ""Lolek"" Wojtyla would become the man ordained as a priest in 1946, then become the..."
9,8,tv_mayday,Mayday,tv show,http://www.metacritic.com/tv/mayday,30,6,0,2,4,4.6,5,1,0,3,NA,CBS,NA,NA,"Oct  2, 2005",NA,NA,NA,120,Movie/Mini-Series,NA,TV Movie,"When a U.S. Navy test missile accidentally strikes a commercial airliner, an amateur pilot on board must try to land the plane and deliver the passengers to safety."
10,9,tv_filth-the-mary-whitehouse-story,Filth: The Mary Whitehouse Story,tv show,http://www.metacritic.com/tv/filth-the-mary-whitehouse-story,72,11,8,3,0,NA,0,1,0,0,NA,BBC-2,NA,NA,"May 28, 2008",NA,NA,NA,90,"[u'Drama', u'Movie/Mini-Series']",NA,TV Movie,Julie Walters plays TV campaigner Mary Whitehouse in this television movie. The story follows the formation of Whitehouse's campaign groups and chronicles how she took on BBC Director General Sir...
11,9,tv_the-pacific,The Pacific,tv show,http://www.metacritic.com/tv/the-pacific,87,32,27,5,0,8.1,123,12,5,1,NA,HBO,NA,NA,"Mar 14, 2010",NA,NA,NA,60,"[u'Drama', u'Movie/Mini-Series']",NA,Ended,"From the creative team behind Band of Brothers comes this ten-hour miniseries tracing three American marines as they fight World War II in the Pacific.
The series was shot on location in..."
12,9,tv_wedding-wars,Wedding Wars,tv show,http://www.metacritic.com/tv/wedding-wars,51,7,2,2,3,NA,0,2,0,0,NA,A&E,NA,NA,"Dec 11, 2006",NA,NA,NA,120,"[u'Comedy', u'Movie/Mini-Series']",NA,TV Movie,"Wedding Wars takes a lighthearted look at the issue of gay marriage starring John Stamos and Eric Dane.  Shel (John Stamos), a gay wedding planner, is asked to plan the wedding of his brother Ben..."
13,9,tv_the-state-within,The State Within,tv show,http://www.metacritic.com/tv/the-state-within,68,15,9,4,2,8.7,10,8,0,0,NA,BBC-1,NA,NA,"Nov  2, 2006",NA,NA,NA,50,"[u'Drama', u'Movie/Mini-Series']",NA,Ended,"This 6-part series stars Jason Isaacs (Brotherhood) as Sir Mark Brydon, the British Ambassador to the United States. Muslim British terrorists detonate a bomb on a British commercial airliner..."
14,10,tv_durham-county,Durham County,tv show,http://www.metacritic.com/tv/durham-county,68,5,3,2,0,8.3,4,1,0,0,NA,The Movie Network,NA,NA,"May  7, 2007",NA,NA,NA,60,"[u'Drama', u'Movie/Mini-Series']",NA,Ended,Mike Sweeney moves his family to Durham County after his partner is murdered. Sweeney is sure that his next-door neighbor is the serial killer responsible for the deaths of two teenage girls as...
15,10,tv_human-trafficking,Human Trafficking,tv show,http://www.metacritic.com/tv/human-trafficking,54,14,6,4,4,9.4,88,64,1,2,NA,Lifetime,NA,NA,"Oct 24, 2005",NA,NA,NA,120,"[u'Drama', u'Movie/Mini-Series']",NA,Mini-Series,Oscar winner Mira Sorvino stars as NYPD detective Kate Morozov in this two-part Lifetime telefilm.  Morozov joins the United States Immigration and Customs Enforcement (ICE) and teams up with Bill...
16,10,tv_the-girl,The Girl,tv show,http://www.metacritic.com/tv/the-girl,66,21,13,7,1,NA,0,0,0,0,NA,HBO,NA,NA,"Oct 20, 2012",NA,NA,NA,60,"[u'Drama', u'Movie/Mini-Series']",NA,New Series,Alfred Hitchcock's (Toby Jones) obsession with actress Tippi Hedren (Sienna Miller) during the filming of The Birds and Marnie is explored in this biopic.
17,10,tv_ethel,Ethel,tv show,http://www.metacritic.com/tv/ethel,67,12,9,2,1,NA,0,0,0,0,NA,HBO,NA,NA,"Oct 18, 2012",NA,NA,NA,60,"[u'Movie/Mini-Series', u'News/Documentary']",NA,TV Movie,"Rory Kennedy chronicles the life of her mother, Ethel Kennedy through family pictures, home movies, news footage, and interviews."
18,10,tv_steel-magnolias,Steel Magnolias,tv show,http://www.metacritic.com/tv/steel-magnolias,75,15,12,3,0,NA,0,0,0,0,NA,Lifetime,NA,NA,"Oct  7, 2012",NA,NA,NA,120,"[u'Drama', u'Movie/Mini-Series']",NA,TV Movie,"Queen Latifah, Phylicia Rashad, Jill Scott,  and Alfre Woodard star in this remake of the 1989 film (and the 1987 play)."
19,10,tv_the-crimson-petal-and-the-white,The Crimson Petal and The White,tv show,http://www.metacritic.com/tv/the-crimson-petal-and-the-white,64,11,6,5,0,NA,0,0,0,0,NA,BBC-2,NA,NA,"Sep 10, 2012",NA,NA,NA,60,"[u'Drama', u'Movie/Mini-Series']",NA,New Series,The heir (Chris O'Dowd) to a perfume business begins an affair with a prostitute named Sugar (Romola Garai) in Victorian London in this British four-part adaptation of Michel Faber's novel airing...
20,11,tv_fatal-honeymoon,Fatal Honeymoon,tv show,http://www.metacritic.com/tv/fatal-honeymoon,53,4,1,3,0,NA,0,0,0,0,NA,Lifetime,NA,NA,"Aug 25, 2012",NA,NA,NA,120,"[u'Drama', u'Movie/Mini-Series']",NA,TV Movie,"A year after Tina Watson (Amber Clayton) drowned during her honeymoon in Australia, her husband Gabe (Billy Miller) stands accused of murder in this TV movie based on a true story."
21,11,tv_about-face-supermodels-then-and-now,About Face: Supermodels Then and Now,tv show,http://www.metacritic.com/tv/about-face-supermodels-then-and-now,72,10,8,2,0,NA,0,0,0,0,NA,HBO,NA,NA,"Jul 30, 2012",NA,NA,NA,60,"[u'Movie/Mini-Series', u'News/Documentary']",NA,TV Movie,"The Timothy Greenfield-Sanders documentary interviewed former supermodels such as Carmen Dell'Orefice, Jerry Hall, Beverly Johnson, and Isabella Rossellini about the modeling industry and the idea..."
22,11,tv_vito,Vito,tv show,http://www.metacritic.com/tv/vito,81,6,6,0,0,NA,0,0,0,0,NA,HBO,NA,NA,"Jul 23, 2012",NA,NA,NA,60,"[u'Movie/Mini-Series', u'News/Documentary']",NA,TV Movie,"Jeffrey Schwartz's 2011 documentary examines the life of AIDS and gay rights activist Vito Russo, who also wrote ""The Celluloid Closet,""  his 1981 book about LGBT depiction in film."
23,11,tv_blue-lagoon-the-awakening,Blue Lagoon: The Awakening,tv show,http://www.metacritic.com/tv/blue-lagoon-the-awakening,50,5,2,1,2,NA,0,NA,NA,NA,NA,Lifetime,NA,NA,"Jun 16, 2012",NA,NA,NA,120,"[u'Drama', u'Movie/Mini-Series']",NA,TV Movie,The remake of the 1980 film starring Brooke Shields and Christopher Atkins has Emma (Indiana Evans) and Dean (Brenton Thwaites) stranded on a deserted island while on a school trip to the Caribbean.
24,11,tv_hemingway-and-gellhorn,Hemingway and Gellhorn,tv show,http://www.metacritic.com/tv/hemingway-and-gellhorn,54,22,10,7,5,5.8,4,1,0,1,NA,HBO,NA,NA,"May 28, 2012",NA,NA,NA,12:00 AM,"[u'Drama', u'Movie/Mini-Series']",NA,TV Movie,The romance between Ernest Hemingway (Clive Owen) and novelist/war correspondent Martha Gellhorn (Nicole Kidman) is depicted in this HBO movie.
25,11,tv_hatfields-mccoys,Hatfields & McCoys,tv show,http://www.metacritic.com/tv/hatfields-mccoys,68,20,11,9,0,7.6,16,4,1,2,NA,The History Channel,NA,NA,"May 28, 2012",NA,NA,NA,60,"[u'Drama', u'Movie/Mini-Series']",NA,Mini-Series,"The story behind the decades long feud between the families headed up by ""Devil"" Anse Hatfield (Kevin Costner) and Randall McCoy (Bill Paxton) is dramatized in this three-part mini-series."
26,11,tv_the-weight-of-the-nation,The Weight of the Nation,tv show,http://www.metacritic.com/tv/the-weight-of-the-nation,81,6,6,0,0,3.5,6,1,0,2,NA,HBO,NA,NA,"May 14, 2012",NA,NA,NA,60,"[u'Movie/Mini-Series', u'News/Documentary']",NA,TV Movie,The four-part documentary looks at the causes and possible solutions to stop the growing numbers of obese Americans.
27,11,tv_titanic,Titanic,tv show,http://www.metacritic.com/tv/titanic,51,10,2,8,0,3.5,11,2,0,2,NA,ABC,NA,NA,"Apr 14, 2012",NA,NA,NA,60,"[u'Drama', u'Movie/Mini-Series']",NA,Mini-Series,The story of the people on the Titanic is retold in this miniseries by Julian Fellowes of Downton Abbey fame.
28,11,tv_the-loving-story,The Loving Story,tv show,http://www.metacritic.com/tv/the-loving-story,81,7,7,0,0,NA,0,NA,NA,NA,NA,HBO,NA,NA,"Feb 14, 2012",NA,NA,NA,60,"[u'Movie/Mini-Series', u'News/Documentary']",NA,TV Movie,The story behind Richard and Mildred Loving's relationship and the impact of the landmark Loving vs. Virginia case that ended the ban against interracial marriage is the subject of this documentary.
29,11,tv_stephen-kings-bag-of-bones,Stephen King's Bag of Bones,tv show,http://www.metacritic.com/tv/stephen-kings-bag-of-bones,47,20,4,10,6,5.9,8,1,1,0,NA,A&E,NA,NA,"Dec 11, 2011",NA,NA,NA,120,"[u'Drama', u'Movie/Mini-Series']",NA,Mini-Series,This is an adaptation of the Stephen King novel about a novelist (Pierce Brosnan) who is haunted by his dead wife.
30,11,tv_the-take,The Take,tv show,http://www.metacritic.com/tv/the-take,80,5,4,1,0,6.5,8,2,1,0,NA,Encore,NA,NA,"Dec  2, 2011",NA,NA,NA,60,"[u'Drama', u'Movie/Mini-Series']",NA,New Series,"After being released from jail, Freddie Jackson (Tom Hardy) plans to utilize the connections he made there to join the criminal underworld in this adaptation of Martina Cole's novel."
31,11,tv_ricochet,Ricochet,tv show,http://www.metacritic.com/tv/ricochet,32,4,0,1,3,NA,0,0,0,0,NA,TNT,NA,NA,"Nov 30, 2011",NA,NA,NA,120,"[u'Drama', u'Movie/Mini-Series']",NA,TV Movie,"TNT's adaptation of Sandra Brown's novel sees Detective Duncan Hatcher (John Corbett) falling in love with Elise Laird (Julie Benz), who is married to a crooked judge (Gary Cole)."
32,12,tv_scott-turows-innocent,Scott Turow's Innocent,tv show,http://www.metacritic.com/tv/scott-turows-innocent,68,9,6,3,0,NA,0,0,0,0,NA,TNT,NA,NA,"Nov 29, 2011",NA,NA,NA,120,"[u'Drama', u'Movie/Mini-Series']",NA,TV Movie,The made-for-TV movie adaptation of Scott Turow's sequel to his 1987 novel Presumed Innocent picks up 20 years later where Rusty Sabich (Bill Pullman) is now a judge and again a suspect in the murder.
33,12,tv_vietnam-in-hd,Vietnam in HD,tv show,http://www.metacritic.com/tv/vietnam-in-hd,78,8,7,1,0,9.0,4,2,0,0,NA,The History Channel,NA,NA,"Nov  8, 2011",NA,NA,NA,60,"[u'Movie/Mini-Series', u'News/Documentary']",NA,Mini-Series,"New, unseen footage is included in the six-part mini-series about the Vietnam War narrated by Michael C. Hall."
34,12,tv_sing-your-song,Sing Your Song,tv show,http://www.metacritic.com/tv/sing-your-song,86,7,7,0,0,NA,0,0,0,0,NA,HBO,NA,NA,"Oct 17, 2011",NA,NA,NA,105,"[u'Movie/Mini-Series', u'News/Documentary']",NA,TV Movie,"The documentary about Harry Belafonte showcases not only his singing and acting career, but also his activism, including his involvement in the civil rights movement and social justice."
35,12,tv_five,Five,tv show,http://www.metacritic.com/tv/five,77,6,5,1,0,6.3,4,0,0,0,NA,Lifetime,NA,NA,"Oct 10, 2011",NA,NA,NA,120,"[u'Drama', u'Movie/Mini-Series']",NA,TV Movie,"The five short films with a cast that includes Patricia Clarkson, Bob Newhart, Ginnifer Goodwin, Rosario Dawson, Tony Shalhoub, Jeanne Tripplehorn, and Jeffrey Tambor focus on the impact of breast..."
36,12,tv_george-harrison-living-in-the-material-world,George Harrison: Living in the Material World,tv show,http://www.metacritic.com/tv/george-harrison-living-in-the-material-world,75,13,10,3,0,7.7,7,2,0,0,NA,HBO,NA,NA,"Oct  5, 2011",NA,NA,NA,215,"[u'Movie/Mini-Series', u'Reality', u'News/Documentary']",NA,TV Movie,"Martin Scorsese documentary focuses on the life of George Harrison, including growing up in Liverpool, The Beatles, and his life after the band with interviews and some never-before-seen footage."
37,12,tv_prohibition,Prohibition,tv show,http://www.metacritic.com/tv/prohibition,86,19,17,2,0,7.9,11,2,0,0,NA,PBS,NA,NA,"Oct  2, 2011",NA,NA,NA,60,"[u'Movie/Mini-Series', u'Reality', u'News/Documentary']",NA,Mini-Series,Ken Burns' latest documentary series focuses on the origins of the 18th Amendment and the eventual end of Prohibition.
38,12,tv_william-catherine-a-royal-romance,William & Catherine: A Royal Romance,tv show,http://www.metacritic.com/tv/william-catherine-a-royal-romance,53,8,2,4,2,NA,0,0,0,0,NA,Hallmark Channel,NA,NA,"Aug 27, 2011",NA,NA,NA,60,"[u'Drama', u'Movie/Mini-Series', u'Reality']",NA,Special Event,"Find out more about the blossoming romance between Kate Middleton and Prince William that ended up being one of the most celebrated weddings in all history. Before Princess Diana died, she left..."
39,12,tv_gloria-in-her-own-words,Gloria: In Her Own Words,tv show,http://www.metacritic.com/tv/gloria-in-her-own-words,79,5,5,0,0,NA,0,0,0,0,NA,HBO,NA,NA,"Aug 15, 2011",NA,NA,NA,61,"[u'Movie/Mini-Series', u'Reality', u'News/Documentary']",NA,TV Movie,"This portrait of Gloria Steinem, a feminist icon for more than 40 years, shows her as a fighter whose focus has been the fight for women's equal rights in the U.S. and around the world."
40,12,tv_theres-something-wrong-with-aunt-diane,There's Something Wrong With Aunt Diane,tv show,http://www.metacritic.com/tv/theres-something-wrong-with-aunt-diane,68,5,4,1,0,NA,0,1,0,0,NA,HBO,NA,NA,"Jul 25, 2011",NA,NA,NA,105,"[u'Movie/Mini-Series', u'News/Documentary']",NA,TV Movie,"On Sunday, July 26, 2009, Diane Schuler left a  campground in upstate New York where she was vacationing with her family and went towards her home in Long Island. She was driving with five young..."
41,12,tv_magic-beyond-words-the-jk-rowling-story,Magic Beyond Words: The J.K. Rowling Story,tv show,http://www.metacritic.com/tv/magic-beyond-words-the-jk-rowling-story,56,4,2,1,1,NA,0,1,0,0,NA,Lifetime,NA,NA,"Jul 18, 2011",NA,NA,NA,90,"[u'Drama', u'Movie/Mini-Series']",NA,TV Movie,J.K. Rowling's story of bringing the worldwide phenomenon on Harry Potter is finally brought to life! She began the story as a single mother on welfare and is now one the world's richest women. Get...
42,12,tv_the-curious-case-of-curt-flood,The Curious Case of Curt Flood,tv show,http://www.metacritic.com/tv/the-curious-case-of-curt-flood,84,4,4,0,0,NA,0,0,0,0,NA,HBO,NA,NA,"Jul 13, 2011",NA,NA,NA,90,"[u'Sports', u'Movie/Mini-Series', u'News/Documentary']",NA,TV Movie,Curt Flood fought against the MLB's Reserve Clause which led to a reform but ultimately destroyed his career.
43,12,tv_citizen-usa-a-50-state-road-trip,Citizen U.S.A.: A 50 State Road Trip,tv show,http://www.metacritic.com/tv/citizen-usa-a-50-state-road-trip,66,8,4,4,0,NA,0,0,0,0,NA,HBO,NA,NA,"Jul  4, 2011",NA,NA,NA,51,"[u'Movie/Mini-Series', u'Reality', u'News/Documentary']",NA,TV Movie,Director Alexandra Pelosi travels across America to attend naturalization ceremonies in all 50 states.
44,12,tv_south-riding,South Riding,tv show,http://www.metacritic.com/tv/south-riding,64,7,4,2,1,7.0,4,1,0,0,NA,BBC-1,NA,NA,"May  1, 2011",NA,NA,NA,60,"[u'Drama', u'Movie/Mini-Series']",NA,Ended,"The First World War is over, so Sarah Burton is returning to her home in Yorkshire after helping with the war effort in London.

A modern woman, her views are foreign to those of her friends. But..."
45,12,tv_beyond-the-blackboard,Beyond The Blackboard,tv show,http://www.metacritic.com/tv/beyond-the-blackboard,69,5,4,1,0,NA,0,NA,NA,NA,NA,CBS,NA,NA,"Apr 24, 2011",NA,NA,NA,100,"[u'Drama', u'Movie/Mini-Series']",NA,TV Movie,Inspired by a true story about a 24-year-old first-time teacher who works to make a difference in the lives of the homeless children she teaches in their shelter's classroom.
46,12,tv_cinema-verite,Cinema Verite,tv show,http://www.metacritic.com/tv/cinema-verite,74,23,14,9,0,6.3,6,0,0,0,NA,HBO,NA,NA,"Apr 23, 2011",NA,NA,NA,90,"[u'Drama', u'Movie/Mini-Series']",NA,TV Movie,"Based on the groundbreaking show from PBS, An American Family, producer Gavin Polone takes viewers behind-the-scenes with the family from the original show and looks into the making of the series."
47,13,tv_the-kennedys,The Kennedys,tv show,http://www.metacritic.com/tv/the-kennedys,50,24,5,14,5,6.0,11,2,2,2,NA,ReelzChannel,NA,NA,"Apr  3, 2011",NA,NA,NA,60,"[u'Drama', u'Movie/Mini-Series']",NA,Mini-Series,"Greg Kinnear has been cast as President John F. Kennedy, Barry Pepper will play Attorney General Robert Kennedy, Katie Holmes will play First Lady Jacqueline Kennedy and Tom Wilkinson will play..."
48,13,tv_lennon-naked,Lennon Naked,tv show,http://www.metacritic.com/tv/lennon-naked,32,6,0,3,3,NA,0,NA,NA,NA,NA,PBS,NA,NA,"Nov 21, 2010",NA,NA,NA,60,"[u'Drama', u'Movie/Mini-Series']",NA,New Series,"John Lennon's life, during the time of The Beatles' break up, is retold in a one-off drama by BBC Four and BBC HD.

He's played by Christopher Eccleston while Naoko Mori plays his wife Yoko Ono."
49,13,tv_any-human-heart,Any Human Heart,tv show,http://www.metacritic.com/tv/any-human-heart,54,6,3,1,2,8.0,5,1,1,0,NA,PBS,NA,NA,"Nov 30, 2009",NA,NA,NA,60,"[u'Drama', u'Movie/Mini-Series']",NA,New Series,"Logan Mountstuart is a writer with a very interesting life.

During his time he travelled a lot and a war, the death of a prime minister and the abdication of a king. But this is not what..."
0,0,tv_homeland-security-usa,Homeland Security USA,tv show,http://www.metacritic.com/tv/homeland-security-usa,47,6,0,6,0,5.8,9,3,0,2,NA,ABC,NA,NA,"Jan  6, 2009",NA,NA,NA,60,"[u'Reality', u'News/Documentary']",NA,Ended,"Shot in cooperation with the U.S. Department of Homeland Security, this ABC reality series documents the functions of United States border agencies and their efforts to stop illegal immigration and..."
1,0,tv_carrier,Carrier,tv show,http://www.metacritic.com/tv/carrier,74,12,8,4,0,9.3,15,6,0,0,NA,PBS,NA,NA,"Apr 27, 2008",NA,NA,NA,120,"[u'Reality', u'News/Documentary']",NA,Ended,"Expose yourself to the world of working on a nuclear aircraft carrier. Filmmakers immerse themselves in the microcosm that is life on the USS Nimitz, as they probe into the professional and person..."
2,7,tv_texas-ranch-house,Texas Ranch House,tv show,http://www.metacritic.com/tv/texas-ranch-house,58,9,5,2,2,6.4,43,23,9,7,NA,PBS,NA,NA,"May  1, 2006",NA,NA,NA,60,"[u'Reality', u'News/Documentary']",NA,New Series,The latest installment in PBSs popular House group of history series is Texas Ranch House.  Texas Ranch House  sends a family back in time to post-Civil War Texas where they experience the...
3,8,tv_this-american-life,This American Life,tv show,http://www.metacritic.com/tv/this-american-life,79,20,18,2,0,9.2,17,10,0,0,NA,Showtime,NA,NA,"Mar 22, 2007",NA,NA,NA,30,News/Documentary,NA,Ended,"The widely popular, award-winning Chicago Public Radio show of the same name debuted on the small screen on March 22, 2007 on Showtime. Drawing on compelling stories from everyday folks culled from..."
4,10,tv_mind-control-with-derren-brown,Mind Control with Derren Brown,tv show,http://www.metacritic.com/tv/mind-control-with-derren-brown,79,5,5,0,0,8.7,16,10,2,0,NA,Syfy,NA,NA,"Jul 26, 2007",NA,NA,NA,30,"[u'Reality', u'News/Documentary']",NA,Returning Series,"SciFi Channel introduces America to mentalist Derren Brown, the British sensation described as ""part James Bond, part Yoda"". Brown already has had numerous top rated shows in the UK and he now..."
5,15,tv_iconoclasts,Iconoclasts,tv show,http://www.metacritic.com/tv/iconoclasts,63,7,4,3,0,NA,0,1,0,1,NA,Sundance,NA,NA,"Nov 17, 2005",NA,NA,NA,60,News/Documentary,NA,New Series,"Debuting on the Sundance Channel, Iconoclasts joins some of today's most influential celebrities with the visionaries that inspire them. The result is a unique, intimate look at both provocative..."
6,16,tv_hopkins,Hopkins,tv show,http://www.metacritic.com/tv/hopkins,78,9,9,0,0,8.7,27,13,0,3,NA,ABC,NA,NA,"Jun 26, 2008",NA,NA,NA,60,News/Documentary,NA,New Series,Baltimore's John Hopkins Hospital is the setting for this documentary series that spotlights real-life drama inside a high-pressure hospital.
